{
  "$schema": "https://json-schema.org/draft/2020-12/schema",
  "$id": "https://optees.org/schemas/simulator/v1/optees_call_receipt.v1.json",
  "title": "OpteesCallReceipt",
  "description": "Immutable receipt recording an invocation of an Optees capability with pinned contract versions, request/response hashes, and redacted transport details.",
  "type": "object",
  "required": [
    "$type",
    "schema_version",
    "receipt_id",
    "round_id",
    "policy_id",
    "capability_id",
    "contract_versions",
    "transport",
    "request_hash",
    "response_hash",
    "validation_receipt",
    "solver_status",
    "timing",
    "redacted_transport_metadata"
  ],
  "additionalProperties": false,
  "properties": {
    "$type": {
      "type": "string",
      "const": "optees_call_receipt"
    },
    "schema_version": {
      "type": "string",
      "const": "1.0.0"
    },
    "receipt_id": {
      "type": "string",
      "pattern": "^rcp-opt_[a-zA-Z0-9_-]+$"
    },
    "round_id": {
      "type": "string",
      "pattern": "^rnd_[a-zA-Z0-9_-]+$"
    },
    "policy_id": {
      "type": "string",
      "pattern": "^pol-def_[a-zA-Z0-9_-]+$"
    },
    "capability_id": {
      "type": "string",
      "minLength": 1
    },
    "contract_versions": {
      "type": "object",
      "required": [
        "problem_schema",
        "result_schema"
      ],
      "additionalProperties": false,
      "properties": {
        "problem_schema": {
          "type": "string",
          "minLength": 1
        },
        "result_schema": {
          "type": "string",
          "minLength": 1
        }
      }
    },
    "transport": {
      "type": "string",
      "enum": ["MCP_STDIO", "LOOPBACK_REST", "FAKE"]
    },
    "request_hash": {
      "type": "string",
      "pattern": "^sha256:[a-f0-9]{64}$"
    },
    "response_hash": {
      "type": "string",
      "pattern": "^sha256:[a-f0-9]{64}$"
    },
    "validation_receipt": {
      "type": "object",
      "required": [
        "status",
        "validator_version",
        "diagnostics"
      ],
      "additionalProperties": false,
      "properties": {
        "status": {
          "type": "string",
          "enum": ["VALID", "INVALID", "SKIPPED"]
        },
        "validator_version": {
          "type": "string",
          "minLength": 1
        },
        "diagnostics": {
          "type": "array",
          "items": {
            "type": "string"
          }
        }
      }
    },
    "solver_status": {
      "type": "string",
      "enum": [
        "OPTIMAL",
        "FEASIBLE",
        "INFEASIBLE",
        "UNBOUNDED",
        "TIMEOUT",
        "FAILED"
      ]
    },
    "timing": {
      "type": "object",
      "required": [
        "submitted_at",
        "completed_at",
        "duration_ms"
      ],
      "additionalProperties": false,
      "properties": {
        "submitted_at": {
          "type": "string",
          "pattern": "^\\d{4}-\\d{2}-\\d{2}T\\d{2}:\\d{2}:\\d{2}(\\.\\d+)?Z$"
        },
        "completed_at": {
          "type": "string",
          "pattern": "^\\d{4}-\\d{2}-\\d{2}T\\d{2}:\\d{2}:\\d{2}(\\.\\d+)?Z$"
        },
        "duration_ms": {
          "type": "number",
          "minimum": 0
        }
      }
    },
    "redacted_transport_metadata": {
      "type": "object",
      "required": [
        "transport_sanitized"
      ],
      "additionalProperties": true,
      "properties": {
        "transport_sanitized": {
          "type": "boolean",
          "const": true
        },
        "process_pid": {
          "type": ["integer", "null"]
        },
        "exit_code": {
          "type": ["integer", "null"]
        }
      }
    }
  }
}
